{
  "schema_version": "1.0.0",
  "manifest_id": "a11oy-integrity-control",
  "revision": "claim-compiler-contract-2026-10-29",
  "generated_at": "2026-10-29T12:22:25Z",
  "claims": [
    {
      "claim_id": "claim-compiler-focused-contract-pass",
      "assertion": "At source revision a6b4d40fc6168270d5b7e47379a7d081b5b76ab4, the EvidenceOS Claim Compiler contract job completed successfully.",
      "maturity": "MEASURED",
      "scope": "The cited GitHub Actions test job only; not production deployment, live endpoint behavior, semantic truth, or EvidenceOS completion across the wider estate.",
      "owner": {
        "owner_id": "szl-holdings:a11oy",
        "accountability_scope": "EvidenceOS Claim Compiler source and test contract"
      },
      "consumers": [
        "claim-compiler-ci",
        "integrity-control"
      ],
      "source": {
        "repository": "szl-holdings/a11oy",
        "revision": "a6b4d40fc6168270d5b7e47379a7d081b5b76ab4"
      },
      "evidence": [
        {
          "evidence_id": "claim-compiler-contract-ci-2026-10-29",
          "path": "artifacts/evidenceos/receipts/claim-compiler-contract-ci.2026-10-29.json",
          "content_sha256": "ab58fade1058bae79ca83c8dca581daf100018a38f016ee7353cc12699942210",
          "collected_at": "2026-10-29T12:22:25Z",
          "max_age_seconds": 2592000,
          "kind": "TEST_RECEIPT",
          "verification_ref": "https://github.com/szl-holdings/a11oy/actions/runs/40872654682/job/123443417478"
        }
      ],
      "reproduction_argv": [
        "python",
        "-m",
        "pytest",
        "-q",
        "tests/test_claim_rupture_gate.py",
        "tests/test_claim_compiler_routes.py",
        "tests/test_integrity_control_surface.py",
        "tests/test_public_claim_manifest.py"
      ]
    }
  ]
}
